Gene_set	Term	Overlap	P-value	Adjusted P-value	Old P-value	Old Adjusted P-value	Odds Ratio	Combined Score	Genes
GO_Biological_Process_2021	negative regulation of extrinsic apoptotic signaling pathway (GO:2001237)	4/80	2.147394121201769e-05	0.0091940929585434	0	0	28.28307254623044	304.0054245457498	TCF7L2;SCG2;TGFBR1;HSPA1B
GO_Biological_Process_2021	regulation of type B pancreatic cell apoptotic process (GO:2000674)	2/5	4.084035796971542e-05	0.0091940929585434	0	0	341.12820512820514	3447.38699212753	NEUROD1;TCF7L2
GO_Biological_Process_2021	negative regulation of epithelial cell apoptotic process (GO:1904036)	3/37	5.918943964727526e-05	0.0091940929585434	0	0	46.26547987616099	450.3836859990114	NEUROD1;TCF7L2;SCG2
GO_Biological_Process_2021	positive regulation of epithelial to mesenchymal transition (GO:0010718)	3/42	8.683120085209544e-05	0.0101158348992691	0	0	40.32388663967611	377.0906221007877	COL1A1;TCF7L2;TGFBR1
GO_Biological_Process_2021	positive regulation of epithelial cell proliferation (GO:0050679)	4/123	0.0001156754152436028	0.0107809487007037	0	0	18.02407449466273	163.383232413654	NOTCH2;TCF7L2;SCG2;TGFBR1
GO_Biological_Process_2021	regulation of extrinsic apoptotic signaling pathway (GO:2001236)	3/64	0.00030542911569196075	0.0237216613187422	0	0	25.75237273511648	208.4343698883337	TCF7L2;SCG2;TGFBR1
GO_Biological_Process_2021	carbohydrate homeostasis (GO:0033500)	3/70	0.0003978799529751688	0.0264874368694898	0	0	23.439120188531028	183.51331528655905	NEUROD1;TCF7L2;BACE2
GO_Biological_Process_2021	negative regulation of apoptotic signaling pathway (GO:2001234)	3/78	0.0005467144208739558	0.0283144637186778	0	0	20.930526315789475	157.22140604885882	TCF7L2;SCG2;TGFBR1
GO_Biological_Process_2021	regulation of cellular response to growth factor stimulus (GO:0090287)	2/17	0.0005468458658113756	0.0283144637186778	0	0	68.18461538461538	512.1580727660178	PCSK6;FSTL1
GO_Biological_Process_2021	collagen fibril organization (GO:0030199)	3/89	0.000803474902271305	0.031201608704869	0	0	18.24326805385557	130.0118284610953	COL1A1;COL4A1;TGFBR1
GO_Biological_Process_2021	glucose homeostasis (GO:0042593)	3/86	0.0007271534271965667	0.031201608704869	0	0	18.90551680405834	136.6183173401744	NEUROD1;TCF7L2;BACE2
GO_Biological_Process_2021	regulation of protein modification by small protein conjugation or removal (GO:1903320)	2/20	0.0007610076105649785	0.031201608704869	0	0	56.81196581196581	407.9591818331578	TGFBR1;HSPA1B
GO_Biological_Process_2021	response to hexose (GO:0009746)	2/25	0.0011938231616913	0.0427939687190905	0	0	44.45039018952063	299.1775464324702	NEUROD1;TCF7L2
GO_Biological_Process_2021	regulation of transmembrane receptor protein serine/threonine kinase signaling pathway (GO:0090092)	2/31	0.0018360888409485	0.0585011373255774	0	0	35.243147656940764	222.03597482014476	PCSK6;FSTL1
GO_Biological_Process_2021	positive regulation of cell differentiation (GO:0045597)	4/258	0.0018830838194928	0.0585011373255774	0	0	8.38689082783571	52.62643592147775	NEUROD1;COL1A1;IGFBP3;TGFBR1
GO_Biological_Process_2021	endothelial cell migration (GO:0043542)	2/39	0.0028957333524111	0.0843382338889748	0	0	27.61191961191961	161.37833034780846	FSTL1;SCG2
GO_Biological_Process_2021	epithelial cell migration (GO:0010631)	2/41	0.0031961694119496	0.0876126438805022	0	0	26.193293885601577	150.50148681155466	FSTL1;SCG2
GO_Biological_Process_2021	positive regulation of stress fiber assembly (GO:0051496)	2/44	0.0036730002408058	0.0950898951230847	0	0	24.31868131868132	136.34868006911373	TGFBR1;PFN2
GO_Biological_Process_2021	regulation of smooth muscle cell proliferation (GO:0048660)	2/49	0.0045365774690402	0.1057022550286376	0	0	21.726132024004364	117.22513584406856	TCF7L2;IGFBP3
GO_Biological_Process_2021	response to glucose (GO:0009749)	2/49	0.0045365774690402	0.1057022550286376	0	0	21.726132024004364	117.22513584406856	NEUROD1;TCF7L2
GO_Biological_Process_2021	positive regulation of actin filament bundle assembly (GO:0032233)	2/51	0.0049057810328166	0.1088616172044077	0	0	20.837257980115123	110.79880549073958	TGFBR1;PFN2
GO_Biological_Process_2021	regulation of osteoclast development (GO:2001204)	1/8	0.0162855052959698	0.1204610391733641	0	0	71.25714285714285	293.399847205648	NOTCH2
GO_Biological_Process_2021	regulation of nucleotide-binding oligomerization domain containing 2 signaling pathway (GO:0070432)	1/6	0.0122385410272356	0.1204610391733641	0	0	99.77	439.3037926149688	HSPA1B
GO_Biological_Process_2021	negative regulation of amyloid precursor protein biosynthetic process (GO:0042985)	1/6	0.0122385410272356	0.1204610391733641	0	0	99.77	439.3037926149688	BACE2
GO_Biological_Process_2021	positive regulation of DNA-binding transcription factor activity (GO:0051091)	3/246	0.013892398564864	0.1204610391733641	0	0	6.405458089668616	27.39238715541041	NEUROD1;ROR1;HSPA1B
GO_Biological_Process_2021	sensory perception of mechanical stimulus (GO:0050954)	2/88	0.0140425321489203	0.1204610391733641	0	0	11.850327966607036	50.54952384380939	COL1A1;ROR1
GO_Biological_Process_2021	positive regulation of cardiac epithelial to mesenchymal transition (GO:0062043)	1/7	0.0142640489654407	0.1204610391733641	0	0	83.1375	353.3354529299383	TGFBR1
GO_Biological_Process_2021	positive regulation of microtubule nucleation (GO:0090063)	1/7	0.0142640489654407	0.1204610391733641	0	0	83.1375	353.3354529299383	HSPA1B
GO_Biological_Process_2021	negative regulation of ruffle assembly (GO:1900028)	1/7	0.0142640489654407	0.1204610391733641	0	0	83.1375	353.3354529299383	PFN2
GO_Biological_Process_2021	skin morphogenesis (GO:0043589)	1/7	0.0142640489654407	0.1204610391733641	0	0	83.1375	353.3354529299383	COL1A1
GO_Biological_Process_2021	marginal zone B cell differentiation (GO:0002315)	1/7	0.0142640489654407	0.1204610391733641	0	0	83.1375	353.3354529299383	NOTCH2
GO_Biological_Process_2021	collagen-activated tyrosine kinase receptor signaling pathway (GO:0038063)	1/7	0.0142640489654407	0.1204610391733641	0	0	83.1375	353.3354529299383	COL1A1
GO_Biological_Process_2021	sensory perception of sound (GO:0007605)	2/91	0.0149641276610933	0.1204610391733641	0	0	11.449150100835494	48.11046712779708	COL1A1;ROR1
GO_Biological_Process_2021	regulation of canonical Wnt signaling pathway (GO:0060828)	3/253	0.0149696041137102	0.1204610391733641	0	0	6.223894736842105	26.151147179392822	COL1A1;TCF7L2;RBMS3
GO_Biological_Process_2021	regulation of endothelial cell proliferation (GO:0001936)	2/92	0.0152770043834475	0.1204610391733641	0	0	11.321367521367522	47.33924045221591	SCG2;TGFBR1
GO_Biological_Process_2021	actin filament reorganization (GO:0090527)	1/8	0.0162855052959698	0.1204610391733641	0	0	71.25714285714285	293.399847205648	NEDD9
GO_Biological_Process_2021	regulation of epithelial to mesenchymal transition involved in endocardial cushion formation (GO:1905005)	1/8	0.0162855052959698	0.1204610391733641	0	0	71.25714285714285	293.399847205648	TGFBR1
GO_Biological_Process_2021	coronary vasculature morphogenesis (GO:0060977)	1/8	0.0162855052959698	0.1204610391733641	0	0	71.25714285714285	293.399847205648	TGFBR1
GO_Biological_Process_2021	ventricular trabecula myocardium morphogenesis (GO:0003222)	1/8	0.0162855052959698	0.1204610391733641	0	0	71.25714285714285	293.399847205648	TGFBR1
GO_Biological_Process_2021	ventricular compact myocardium morphogenesis (GO:0003223)	1/6	0.0122385410272356	0.1204610391733641	0	0	99.77	439.3037926149688	TGFBR1
GO_Biological_Process_2021	maintenance of DNA repeat elements (GO:0043570)	1/6	0.0122385410272356	0.1204610391733641	0	0	99.77	439.3037926149688	TCF7L2
GO_Biological_Process_2021	sequestering of BMP from receptor via BMP binding (GO:0038098)	1/8	0.0162855052959698	0.1204610391733641	0	0	71.25714285714285	293.399847205648	FSTL1
GO_Biological_Process_2021	heat acclimation (GO:0010286)	1/6	0.0122385410272356	0.1204610391733641	0	0	99.77	439.3037926149688	HSPA1B
GO_Biological_Process_2021	cellular heat acclimation (GO:0070370)	1/6	0.0122385410272356	0.1204610391733641	0	0	99.77	439.3037926149688	HSPA1B
GO_Biological_Process_2021	blood vessel morphogenesis (GO:0048514)	2/56	0.0058872481684318	0.1204610391733641	0	0	18.903133903133902	97.06696112383608	COL4A1;TGFBR1
GO_Biological_Process_2021	chordate embryonic development (GO:0043009)	2/58	0.0063029292367822	0.1204610391733641	0	0	18.226190476190474	92.34738283089771	COL1A1;TGFBR1
GO_Biological_Process_2021	actin cytoskeleton reorganization (GO:0031532)	2/63	0.0073989136389168	0.1204610391733641	0	0	16.728036990332072	82.07481029702832	THSD7B;NEDD9
GO_Biological_Process_2021	protein secretion (GO:0009306)	2/64	0.0076277365536019	0.1204610391733641	0	0	16.457402812241522	80.24570576240087	NEUROD1;SCG2
GO_Biological_Process_2021	regulation of stress fiber assembly (GO:0051492)	2/74	0.0100885355513959	0.1204610391733641	0	0	14.164529914529917	65.1052163056749	TGFBR1;PFN2
GO_Biological_Process_2021	amacrine cell differentiation (GO:0035881)	1/5	0.0102089737568119	0.1204610391733641	0	0	124.71875	571.7716333774792	NEUROD1
GO_Biological_Process_2021	positive regulation of epithelial to mesenchymal transition involved in endocardial cushion formation (GO:1905007)	1/5	0.0102089737568119	0.1204610391733641	0	0	124.71875	571.7716333774792	TGFBR1
GO_Biological_Process_2021	renal tubule development (GO:0061326)	1/5	0.0102089737568119	0.1204610391733641	0	0	124.71875	571.7716333774792	COL4A1
GO_Biological_Process_2021	extracellular structure organization (GO:0043062)	3/216	0.0097930473559282	0.1204610391733641	0	0	7.318754633061527	33.85716345116212	COL1A1;COL4A1;TGFBR1
GO_Biological_Process_2021	regulation of growth rate (GO:0040009)	1/5	0.0102089737568119	0.1204610391733641	0	0	124.71875	571.7716333774792	NOTCH2
GO_Biological_Process_2021	glandular epithelial cell differentiation (GO:0002067)	1/6	0.0122385410272356	0.1204610391733641	0	0	99.77	439.3037926149688	NEUROD1
GO_Biological_Process_2021	positive regulation of nucleotide-binding oligomerization domain containing signaling pathway (GO:0070426)	1/5	0.0102089737568119	0.1204610391733641	0	0	124.71875	571.7716333774792	HSPA1B
GO_Biological_Process_2021	regulation of epithelial to mesenchymal transition (GO:0010717)	2/76	0.0106176633448387	0.1204610391733641	0	0	13.78031878031878	62.63480530302272	COL1A1;TGFBR1
GO_Biological_Process_2021	regulation of BMP signaling pathway (GO:0030510)	2/76	0.0106176633448387	0.1204610391733641	0	0	13.78031878031878	62.63480530302272	PCSK6;FSTL1
GO_Biological_Process_2021	positive regulation of endothelial cell proliferation (GO:0001938)	2/77	0.0108867636641719	0.1204610391733641	0	0	13.595897435897436	61.45627851605956	SCG2;TGFBR1
GO_Biological_Process_2021	enteroendocrine cell differentiation (GO:0035883)	1/5	0.0102089737568119	0.1204610391733641	0	0	124.71875	571.7716333774792	NEUROD1
GO_Biological_Process_2021	coronary artery morphogenesis (GO:0060982)	1/5	0.0102089737568119	0.1204610391733641	0	0	124.71875	571.7716333774792	TGFBR1
GO_Biological_Process_2021	regulation of hormone metabolic process (GO:0032350)	1/5	0.0102089737568119	0.1204610391733641	0	0	124.71875	571.7716333774792	TCF7L2
GO_Biological_Process_2021	positive regulation of cell motility (GO:2000147)	3/221	0.0104187142470669	0.1204610391733641	0	0	7.14908256880734	32.62949695283876	COL1A1;NEDD9;TGFBR1
GO_Biological_Process_2021	Notch signaling involved in heart development (GO:0061314)	1/11	0.0223256423422114	0.1223970509584768	0	0	49.8725	189.6162115443105	NOTCH2
GO_Biological_Process_2021	proteolysis (GO:0006508)	3/287	0.0208638305307696	0.1223970509584768	0	0	5.469329132690882	21.164871959767403	BACE2;OLR1;PCSK6
GO_Biological_Process_2021	synaptic transmission, GABAergic (GO:0051932)	1/11	0.0223256423422114	0.1223970509584768	0	0	49.8725	189.6162115443105	GABRG1
GO_Biological_Process_2021	regulation of inclusion body assembly (GO:0090083)	1/11	0.0223256423422114	0.1223970509584768	0	0	49.8725	189.6162115443105	HSPA1B
GO_Biological_Process_2021	induction of positive chemotaxis (GO:0050930)	1/11	0.0223256423422114	0.1223970509584768	0	0	49.8725	189.6162115443105	SCG2
GO_Biological_Process_2021	response to sterol (GO:0036314)	1/11	0.0223256423422114	0.1223970509584768	0	0	49.8725	189.6162115443105	TGFBR1
GO_Biological_Process_2021	atrial septum morphogenesis (GO:0060413)	1/11	0.0223256423422114	0.1223970509584768	0	0	49.8725	189.6162115443105	NOTCH2
GO_Biological_Process_2021	regulation of amyloid precursor protein biosynthetic process (GO:0042984)	1/11	0.0223256423422114	0.1223970509584768	0	0	49.8725	189.6162115443105	BACE2
GO_Biological_Process_2021	regulation of protein ubiquitination (GO:0031396)	2/109	0.0210172420194967	0.1223970509584768	0	0	9.514497963096094	36.74891233959532	TGFBR1;HSPA1B
GO_Biological_Process_2021	endothelium development (GO:0003158)	1/10	0.0203162941970357	0.1223970509584768	0	0	55.41666666666666	215.92173416578157	FSTL1
GO_Biological_Process_2021	positive regulation of keratinocyte proliferation (GO:0010838)	1/11	0.0223256423422114	0.1223970509584768	0	0	49.8725	189.6162115443105	NOTCH2
GO_Biological_Process_2021	regulation of microtubule nucleation (GO:0010968)	1/10	0.0203162941970357	0.1223970509584768	0	0	55.41666666666666	215.92173416578157	HSPA1B
GO_Biological_Process_2021	regulation of apoptotic process (GO:0042981)	5/742	0.0172285608287083	0.1223970509584768	0	0	3.62241821197045	14.711316877991864	NOTCH2;NEUROD1;IGFBP3;FSTL1;HSPA1B
GO_Biological_Process_2021	positive regulation of cell migration (GO:0030335)	3/269	0.0176059691290225	0.1223970509584768	0	0	5.8447764147210135	23.610075321378275	COL1A1;NEDD9;TGFBR1
GO_Biological_Process_2021	negative regulation of glycoprotein biosynthetic process (GO:0010561)	1/9	0.0183029177773926	0.1223970509584768	0	0	62.346875	249.43081801374976	BACE2
GO_Biological_Process_2021	lipoprotein metabolic process (GO:0042157)	1/9	0.0183029177773926	0.1223970509584768	0	0	62.346875	249.43081801374976	OLR1
GO_Biological_Process_2021	defense response to tumor cell (GO:0002357)	1/10	0.0203162941970357	0.1223970509584768	0	0	55.41666666666666	215.92173416578157	RBMS3
GO_Biological_Process_2021	positive regulation of tumor necrosis factor-mediated signaling pathway (GO:1903265)	1/9	0.0183029177773926	0.1223970509584768	0	0	62.346875	249.43081801374976	HSPA1B
GO_Biological_Process_2021	regulation of insulin secretion (GO:0050796)	2/104	0.0192478878212215	0.1223970509584768	0	0	9.98340874811463	39.43799816102823	NEUROD1;TCF7L2
GO_Biological_Process_2021	negative regulation of inclusion body assembly (GO:0090084)	1/10	0.0203162941970357	0.1223970509584768	0	0	55.41666666666666	215.92173416578157	HSPA1B
GO_Biological_Process_2021	complement activation, lectin pathway (GO:0001867)	1/10	0.0203162941970357	0.1223970509584768	0	0	55.41666666666666	215.92173416578157	MASP1
GO_Biological_Process_2021	collagen-activated signaling pathway (GO:0038065)	1/9	0.0183029177773926	0.1223970509584768	0	0	62.346875	249.43081801374976	COL1A1
GO_Biological_Process_2021	regulation of cell cycle (GO:0051726)	3/296	0.0226093090504372	0.1225109071802764	0	0	5.298904257230106	20.079633628334577	NOTCH2;TCF7L2;TGFBR1
GO_Biological_Process_2021	extracellular matrix organization (GO:0030198)	3/300	0.0234100696744602	0.1253918674517066	0	0	5.226475279106858	19.62326670258423	COL1A1;COL4A1;TGFBR1
GO_Biological_Process_2021	negative regulation of smooth muscle cell migration (GO:0014912)	1/14	0.0283295950973344	0.1257294410986463	0	0	38.35769230769231	136.70099489654157	IGFBP3
GO_Biological_Process_2021	pancreas development (GO:0031016)	1/14	0.0283295950973344	0.1257294410986463	0	0	38.35769230769231	136.70099489654157	TCF7L2
GO_Biological_Process_2021	thymus development (GO:0048538)	1/14	0.0283295950973344	0.1257294410986463	0	0	38.35769230769231	136.70099489654157	TGFBR1
GO_Biological_Process_2021	positive regulation of SMAD protein signal transduction (GO:0060391)	1/14	0.0283295950973344	0.1257294410986463	0	0	38.35769230769231	136.70099489654157	TGFBR1
GO_Biological_Process_2021	regulation of lipase activity (GO:0060191)	1/14	0.0283295950973344	0.1257294410986463	0	0	38.35769230769231	136.70099489654157	PCSK6
GO_Biological_Process_2021	neuron fate commitment (GO:0048663)	1/14	0.0283295950973344	0.1257294410986463	0	0	38.35769230769231	136.70099489654157	TGFBR1
GO_Biological_Process_2021	synaptic membrane adhesion (GO:0099560)	1/14	0.0283295950973344	0.1257294410986463	0	0	38.35769230769231	136.70099489654157	GPC6
GO_Biological_Process_2021	endothelial cell differentiation (GO:0045446)	1/14	0.0283295950973344	0.1257294410986463	0	0	38.35769230769231	136.70099489654157	FSTL1
GO_Biological_Process_2021	sequestering of extracellular ligand from receptor (GO:0035581)	1/14	0.0283295950973344	0.1257294410986463	0	0	38.35769230769231	136.70099489654157	FSTL1
GO_Biological_Process_2021	atrial septum development (GO:0003283)	1/14	0.0283295950973344	0.1257294410986463	0	0	38.35769230769231	136.70099489654157	NOTCH2
GO_Biological_Process_2021	negative regulation of cartilage development (GO:0061037)	1/14	0.0283295950973344	0.1257294410986463	0	0	38.35769230769231	136.70099489654157	TGFBR1
GO_Biological_Process_2021	negative regulation of gene expression (GO:0010629)	3/322	0.028089235017292	0.1257294410986463	0	0	4.860584062035968	17.363799200586044	NOTCH2;HSPA1B;RBMS3
GO_Biological_Process_2021	negative regulation of growth (GO:0045926)	2/126	0.0275133867940818	0.1257294410986463	0	0	8.203060380479736	29.474273521841045	NOTCH2;HSPA1B
GO_Biological_Process_2021	pathway-restricted SMAD protein phosphorylation (GO:0060389)	1/13	0.0263322850072555	0.1257294410986463	0	0	41.55625	151.13839929513645	TGFBR1
GO_Biological_Process_2021	mature B cell differentiation involved in immune response (GO:0002313)	1/13	0.0263322850072555	0.1257294410986463	0	0	41.55625	151.13839929513645	NOTCH2
GO_Biological_Process_2021	positive regulation of apoptotic process (GO:0043065)	3/310	0.0254792893085015	0.1257294410986463	0	0	5.053660209154809	18.54637373359319	NEUROD1;IGFBP3;TGFBR1
GO_Biological_Process_2021	cytoskeleton organization (GO:0007010)	2/120	0.0251378859087683	0.1257294410986463	0	0	8.62277270751847	31.760941396505185	FGD6;NEDD9
GO_Biological_Process_2021	branching involved in blood vessel morphogenesis (GO:0001569)	1/14	0.0283295950973344	0.1257294410986463	0	0	38.35769230769231	136.70099489654157	COL4A1
GO_Biological_Process_2021	myoblast differentiation (GO:0045445)	1/15	0.0303229080772226	0.1296373868255574	0	0	35.61607142857143	124.50850776759756	TCF7L2
GO_Biological_Process_2021	embryonic cranial skeleton morphogenesis (GO:0048701)	1/15	0.0303229080772226	0.1296373868255574	0	0	35.61607142857143	124.50850776759756	TGFBR1
GO_Biological_Process_2021	negative regulation of chondrocyte differentiation (GO:0032331)	1/15	0.0303229080772226	0.1296373868255574	0	0	35.61607142857143	124.50850776759756	TGFBR1
GO_Biological_Process_2021	positive regulation of protein export from nucleus (GO:0046827)	1/15	0.0303229080772226	0.1296373868255574	0	0	35.61607142857143	124.50850776759756	TCF7L2
GO_Biological_Process_2021	pharyngeal system development (GO:0060037)	1/17	0.0342975737471893	0.1310541623791499	0	0	31.1609375	105.09589136420657	TGFBR1
GO_Biological_Process_2021	positive chemotaxis (GO:0050918)	1/18	0.0362789419461595	0.1310541623791499	0	0	29.326470588235296	97.26176223664352	SCG2
GO_Biological_Process_2021	regulation of presynapse organization (GO:0099174)	1/18	0.0362789419461595	0.1310541623791499	0	0	29.326470588235296	97.26176223664352	GPC6
GO_Biological_Process_2021	regulation of presynapse assembly (GO:1905606)	1/18	0.0362789419461595	0.1310541623791499	0	0	29.326470588235296	97.26176223664352	GPC6
GO_Biological_Process_2021	nitric oxide mediated signal transduction (GO:0007263)	1/18	0.0362789419461595	0.1310541623791499	0	0	29.326470588235296	97.26176223664352	NEUROD1
GO_Biological_Process_2021	positive regulation of myoblast differentiation (GO:0045663)	1/18	0.0362789419461595	0.1310541623791499	0	0	29.326470588235296	97.26176223664352	IGFBP3
GO_Biological_Process_2021	pulmonary valve development (GO:0003177)	1/18	0.0362789419461595	0.1310541623791499	0	0	29.326470588235296	97.26176223664352	NOTCH2
GO_Biological_Process_2021	negative regulation of cell migration (GO:0030336)	2/144	0.0351533873635987	0.1310541623791499	0	0	7.156735283495847	23.960995180550217	IGFBP3;PFN2
GO_Biological_Process_2021	supramolecular fiber organization (GO:0097435)	3/351	0.0349658770641807	0.1310541623791499	0	0	4.448956442831216	14.919053275169658	COL1A1;COL4A1;TGFBR1
GO_Biological_Process_2021	positive regulation of positive chemotaxis (GO:0050927)	1/17	0.0342975737471893	0.1310541623791499	0	0	31.1609375	105.09589136420657	SCG2
GO_Biological_Process_2021	post-translational protein modification (GO:0043687)	3/345	0.0334773265231598	0.1310541623791499	0	0	4.528393351800554	15.382440007237028	IGFBP3;FSTL1;SCG2
GO_Biological_Process_2021	amyloid-beta metabolic process (GO:0050435)	1/17	0.0342975737471893	0.1310541623791499	0	0	31.1609375	105.09589136420657	BACE2
GO_Biological_Process_2021	pulmonary valve morphogenesis (GO:0003184)	1/17	0.0342975737471893	0.1310541623791499	0	0	31.1609375	105.09589136420657	NOTCH2
GO_Biological_Process_2021	cell surface receptor signaling pathway involved in heart development (GO:0061311)	1/17	0.0342975737471893	0.1310541623791499	0	0	31.1609375	105.09589136420657	NOTCH2
GO_Biological_Process_2021	enzyme linked receptor protein signaling pathway (GO:0007167)	2/140	0.0333910781691019	0.1310541623791499	0	0	7.365663322185061	25.039325974556625	NEDD9;ROR1
GO_Biological_Process_2021	eosinophil migration (GO:0072677)	1/16	0.0323122317033933	0.1310541623791499	0	0	33.24	114.08996545091124	SCG2
GO_Biological_Process_2021	eosinophil chemotaxis (GO:0048245)	1/16	0.0323122317033933	0.1310541623791499	0	0	33.24	114.08996545091124	SCG2
GO_Biological_Process_2021	mesenchyme development (GO:0060485)	1/16	0.0323122317033933	0.1310541623791499	0	0	33.24	114.08996545091124	TGFBR1
GO_Biological_Process_2021	basement membrane organization (GO:0071711)	1/16	0.0323122317033933	0.1310541623791499	0	0	33.24	114.08996545091124	COL4A1
GO_Biological_Process_2021	filopodium assembly (GO:0046847)	1/16	0.0323122317033933	0.1310541623791499	0	0	33.24	114.08996545091124	FGD6
GO_Biological_Process_2021	regulation of mitotic spindle assembly (GO:1901673)	1/19	0.0382563440505893	0.1320552320561084	0	0	27.695833333333333	90.3838530444344	HSPA1B
GO_Biological_Process_2021	regulation of insulin-like growth factor receptor signaling pathway (GO:0043567)	1/19	0.0382563440505893	0.1320552320561084	0	0	27.695833333333333	90.3838530444344	IGFBP3
GO_Biological_Process_2021	cardiac atrium morphogenesis (GO:0003209)	1/19	0.0382563440505893	0.1320552320561084	0	0	27.695833333333333	90.3838530444344	NOTCH2
GO_Biological_Process_2021	activin receptor signaling pathway (GO:0032924)	1/19	0.0382563440505893	0.1320552320561084	0	0	27.695833333333333	90.3838530444344	TGFBR1
GO_Biological_Process_2021	response to cholesterol (GO:0070723)	1/19	0.0382563440505893	0.1320552320561084	0	0	27.695833333333333	90.3838530444344	TGFBR1
GO_Biological_Process_2021	heart trabecula morphogenesis (GO:0061384)	1/19	0.0382563440505893	0.1320552320561084	0	0	27.695833333333333	90.3838530444344	TGFBR1
GO_Biological_Process_2021	negative regulation of cell communication (GO:0010648)	1/21	0.0421992808273308	0.1337745909220146	0	0	24.92375	78.89244440466216	IGFBP3
GO_Biological_Process_2021	positive regulation of transcription regulatory region DNA binding (GO:2000679)	1/21	0.0421992808273308	0.1337745909220146	0	0	24.92375	78.89244440466216	NEUROD1
GO_Biological_Process_2021	regulation of lipoprotein lipase activity (GO:0051004)	1/21	0.0421992808273308	0.1337745909220146	0	0	24.92375	78.89244440466216	PCSK6
GO_Biological_Process_2021	regulation of cardiac muscle cell proliferation (GO:0060043)	1/21	0.0421992808273308	0.1337745909220146	0	0	24.92375	78.89244440466216	TGFBR1
GO_Biological_Process_2021	skeletal system development (GO:0001501)	2/158	0.0415976351984421	0.1337745909220146	0	0	6.509861932938856	20.69948584300281	COL1A1;TGFBR1
GO_Biological_Process_2021	sensory perception of pain (GO:0019233)	1/21	0.0421992808273308	0.1337745909220146	0	0	24.92375	78.89244440466216	SCN9A
GO_Biological_Process_2021	insulin secretion (GO:0030073)	1/20	0.0402297877766736	0.1337745909220146	0	0	26.23684210526316	84.30284540999916	NEUROD1
GO_Biological_Process_2021	cardiac epithelial to mesenchymal transition (GO:0060317)	1/20	0.0402297877766736	0.1337745909220146	0	0	26.23684210526316	84.30284540999916	TGFBR1
GO_Biological_Process_2021	regulation of smooth muscle cell migration (GO:0014910)	1/20	0.0402297877766736	0.1337745909220146	0	0	26.23684210526316	84.30284540999916	IGFBP3
GO_Biological_Process_2021	adaptive immune response based on somatic recombination of immune receptors built from immunoglobulin superfamily domains (GO:0002460)	1/20	0.0402297877766736	0.1337745909220146	0	0	26.23684210526316	84.30284540999916	BACH2
GO_Biological_Process_2021	positive regulation of NF-kappaB transcription factor activity (GO:0051092)	2/155	0.0401814145340901	0.1337745909220146	0	0	6.638511814982404	21.33850520091635	ROR1;HSPA1B
GO_Biological_Process_2021	regulation of cell differentiation (GO:0045595)	2/156	0.0406513889726385	0.1337745909220146	0	0	6.595071595071596	21.12218269948091	NEUROD1;TGFBR1
GO_Biological_Process_2021	negative regulation of programmed cell death (GO:0043069)	3/381	0.042917993622027	0.1345851674358797	0	0	4.089598997493734	12.875955664777331	NOTCH2;FSTL1;HSPA1B
GO_Biological_Process_2021	positive regulation of protein kinase B signaling (GO:0051897)	2/161	0.0430325964548199	0.1345851674358797	0	0	6.386066763425254	20.08927217833312	TCF7L2;TGFBR1
GO_Biological_Process_2021	positive regulation of macromolecule metabolic process (GO:0010604)	3/384	0.0437594649101608	0.1359460709875663	0	0	4.056775797762122	12.693843554554585	TGFBR1;HSPA1B;RBMS3
