Gene_set	Term	Overlap	P-value	Adjusted P-value	Old P-value	Old Adjusted P-value	Odds Ratio	Combined Score	Genes
GO_Biological_Process_2021	MAPK cascade (GO:0000165)	1/303	0.4655588323657565	0.4789192403585927	0	0	1.6272350993377482	1.244048579019679	SCG2
GO_Biological_Process_2021	chemical synaptic transmission (GO:0007268)	1/306	0.4688894264028042	0.4812829795235832	0	0	1.610983606557377	1.2201401398221907	GABRG1
GO_Biological_Process_2021	regulation of transcription by RNA polymerase II (GO:0006357)	5/2206	0.4779514806643226	0.489506351625438	0	0	1.1205765056287549	0.8272611863194806	NEUROD1;TCF7L2;ZFHX4;BACH2;VGLL3
GO_Biological_Process_2021	transcription by RNA polymerase II (GO:0006366)	1/320	0.4841663436455454	0.4947840266202284	0	0	1.5391849529780564	1.1164120135799158	NOTCH2
GO_Biological_Process_2021	positive regulation of cytokine production (GO:0001819)	1/335	0.5000587098127072	0.5099066931569399	0	0	1.468937125748503	1.018017155210938	HSPA1B
GO_Biological_Process_2021	protein transport (GO:0015031)	1/369	0.534333454366166	0.5436667898136099	0	0	1.3309103260869566	0.8341283341351259	SCG2
GO_Biological_Process_2021	positive regulation of transcription by RNA polymerase II (GO:0045944)	2/908	0.561221701281523	0.5697806379023742	0	0	1.0784513499745287	0.6229558419842547	NEUROD1;TCF7L2
GO_Biological_Process_2021	regulation of nucleic acid-templated transcription (GO:1903506)	1/430	0.5901706323977317	0.5978685102116151	0	0	1.138111888111888	0.6001759934669464	TGFBR1
GO_Biological_Process_2021	negative regulation of nucleic acid-templated transcription (GO:1903507)	1/464	0.6183993387554868	0.6251064899350475	0	0	1.0526997840172787	0.5059494660338417	TCF7L2
GO_Biological_Process_2021	regulation of cellular macromolecule biosynthetic process (GO:2000112)	1/468	0.6215929474623557	0.6269747045832419	0	0	1.0434689507494648	0.4961380002137858	TGFBR1
GO_Biological_Process_2021	negative regulation of cellular macromolecule biosynthetic process (GO:2000113)	1/547	0.6795796695216216	0.6839829935142023	0	0	0.8888736263736263	0.3433548199312514	TCF7L2
GO_Biological_Process_2021	cytokine-mediated signaling pathway (GO:0019221)	1/621	0.7259775220900888	0.7291067355473737	0	0	0.7797983870967742	0.2497196924819235	TNFSF13B
GO_Biological_Process_2021	negative regulation of transcription by RNA polymerase II (GO:0000122)	1/684	0.7602571362292125	0.7618920978125012	0	0	0.7055636896046852	0.1933939953879107	TCF7L2
GO_Biological_Process_2021	negative regulation of transcription, DNA-templated (GO:0045892)	1/948	0.8637142433247664	0.8637142433247664	0	0	0.5019007391763464	0.0735351344606526	TCF7L2
